url,name
https://static.e-publishing.af.mil/production/1/saf_aq/publication/afi64-102/afi64-102.pdf,AFI64-102 INSTALLATION CONTRACTING
https://static.e-publishing.af.mil/production/1/saf_aq/publication/afi64-103/afi64-103.pdf,"AFI64-103 LEASING NON-EXCESS UNITED STATES AIR FORCE (USAF) AIRCRAFT, AIRCRAFT-RELATED EQUIPMENT AND OTHER PERSONAL PROPERTY TO NON-GOVERNMENT ORGANIZATIONS"
https://static.e-publishing.af.mil/production/1/saf_aq/publication/afi64-105/afi64-105.pdf,AFI64-105 CONTINGENCY CONTRACTING SUPPORT
https://static.e-publishing.af.mil/production/1/saf_aq/publication/afi64-106/dafi64-106.pdf,AFI64-106 CONTRACTOR LABOR RELATIONS ACTIVITIES
https://static.e-publishing.af.mil/production/1/saf_aq/publication/afman64-118/afman64-118.pdf,AFMAN64-118 AIR FORCE NONAPPROPRIATED FUND (NAF) PURCHASE CARD PROGRAM
https://static.e-publishing.af.mil/production/1/saf_aq/publication/afpd64-1/afpd64-1.pdf,AFPD64-1 THE CONTRACTING SYSTEM
https://static.e-publishing.af.mil/production/1/saf_aq/publication/dafi64-117/dafi64-117.pdf,DAFI64-117 GOVERNMENT PURCHASE CARD PROGRAM
https://static.e-publishing.af.mil/production/1/saf_aq/publication/dafman64-119/dafman64-119.pdf,DAFMAN64-119 NONAPPROPRIATED FUND (NAF) CONTRACTING PROCEDURES
